{
  "admission_checks": {
    "bounded_wording": true,
    "counterevidence_protocol_complete": true,
    "deterministic_replay": true,
    "direct_entailment": true,
    "exact_detector_applicability": true,
    "material_premise_ids": [
      "premise:contrast-orientation"
    ],
    "no_reversing_unknown": true,
    "non_inferences": [
      "No global workflow correctness claim is established."
    ],
    "source_references_resolved": true,
    "unresolved_material_premise_ids": []
  },
  "affected_record_refs": [
    {
      "record_id": "claim:1",
      "record_type": "claim"
    }
  ],
  "audit_bundle_digest": "sha256:2222222222222222222222222222222222222222222222222222222222222222",
  "audit_bundle_ref": {
    "record_id": "bundle:1",
    "record_type": "audit_bundle"
  },
  "bounded_statement": "The report states a positive direction while the linked result is negative under the resolved contrast orientation.",
  "candidate_created_at": "2026-07-28T20:00:00Z",
  "case_id": "case:gene-1",
  "detector_id": "detector:claim-direction",
  "detector_manifest_digest": "sha256:4444444444444444444444444444444444444444444444444444444444444444",
  "detector_version": "1.0.0",
  "evaluation_candidate_id": "evaluation-candidate:case-1",
  "evidence": [
    {
      "description": "The candidate and adjudicated root cite the same frozen claim span.",
      "evidence_id": "evidence:stage3-source",
      "record_refs": [
        {
          "record_id": "claim:1",
          "record_type": "claim"
        }
      ],
      "source_refs": [],
      "support_role": "supports"
    }
  ],
  "fixture_ref": {
    "record_id": "fixture:case-1",
    "record_type": "benchmark_fixture"
  },
  "issue_class": "claim_result_disagreement",
  "maturity_gate_bypassed_for_evaluation": true,
  "non_inferences": [
    "This qualification-only candidate is not a production Finding.",
    "Bypassing maturity for evaluation does not grant Finding authority."
  ],
  "production_admission_permitted": false,
  "production_finding_ref": null,
  "proposed_assessment_type": "finding",
  "provenance": {
    "actor": {
      "actor_id": "software:sc-referee-eval",
      "actor_kind": "controller",
      "display_name": "sc-referee evaluation controller"
    },
    "created_at": "2026-07-28T20:00:00Z",
    "method": "deterministic_evaluation_candidate_projection",
    "tool": "sc-referee-eval",
    "tool_version": "0.6.0"
  },
  "record_type": "detector_evaluation_candidate",
  "root_locator": {
    "explanation": "The exact report and result directions disagree.",
    "root_ref": {
      "record_id": "result:1",
      "record_type": "observed_result"
    },
    "violated_semantic_dimension": "comparison_direction"
  },
  "schema_version": "0.10.0",
  "scientific_label_freeze_digest": "sha256:1111111111111111111111111111111111111111111111111111111111111111",
  "semantic_lock_digest": "sha256:3333333333333333333333333333333333333333333333333333333333333333",
  "source_detector_result_digest": "sha256:5555555555555555555555555555555555555555555555555555555555555555",
  "source_detector_result_ref": {
    "record_id": "result:claim-direction",
    "record_type": "detector_result"
  },
  "subject_refs": [
    {
      "record_id": "claim:1",
      "record_type": "claim"
    }
  ],
  "title": "Reported direction disagrees with the linked result"
}
